{
  "schema_version": 1,
  "id": "delphi-fpc-scalar-to-rust",
  "source_frontend": "sourcebridge-delphi",
  "target_backend": "sourcebridge-rust",
  "rule_layers": [
    "fpc-3.2.3-scalar-addition"
  ],
  "runtime_adapters": [],
  "options": {
    "source_variant": "fpc-3.2.3-x86_64-linux-delphi",
    "scope": "verified-integer-cardinal-addition"
  }
}
